{
  "suite": "wilson_ci",
  "description": "Wilson score confidence intervals (two-sided)",
  "method": "qnorm-based Wilson score interval",
  "tolerance": 1e-10,
  "cases": [
    {
      "name": "fair_coin_100_trials_95pct",
      "inputs": {
        "successes": 50,
        "trials": 100,
        "confidence": 0.95
      },
      "expected": {
        "lower": 0.403831530365996,
        "upper": 0.596168469634004,
        "point": 0.5
      }
    },
    {
      "name": "high_rate_95_of_100_95pct",
      "inputs": {
        "successes": 95,
        "trials": 100,
        "confidence": 0.95
      },
      "expected": {
        "lower": 0.888249530768081,
        "upper": 0.978456320845632,
        "point": 0.95
      }
    },
    {
      "name": "perfect_baseline_100_of_100_95pct",
      "inputs": {
        "successes": 100,
        "trials": 100,
        "confidence": 0.95
      },
      "expected": {
        "lower": 0.963006501793014,
        "upper": 1,
        "point": 1
      }
    },
    {
      "name": "zero_successes_0_of_100_95pct",
      "inputs": {
        "successes": 0,
        "trials": 100,
        "confidence": 0.95
      },
      "expected": {
        "lower": 3.46944695195361e-18,
        "upper": 0.0369934982069857,
        "point": 0
      }
    },
    {
      "name": "small_sample_3_of_5_95pct",
      "inputs": {
        "successes": 3,
        "trials": 5,
        "confidence": 0.95
      },
      "expected": {
        "lower": 0.230724281276013,
        "upper": 0.882379225767352,
        "point": 0.6
      }
    },
    {
      "name": "large_sample_950_of_1000_95pct",
      "inputs": {
        "successes": 950,
        "trials": 1000,
        "confidence": 0.95
      },
      "expected": {
        "lower": 0.934686179755749,
        "upper": 0.961869737607251,
        "point": 0.95
      }
    },
    {
      "name": "fair_coin_100_trials_90pct",
      "inputs": {
        "successes": 50,
        "trials": 100,
        "confidence": 0.9
      },
      "expected": {
        "lower": 0.41884779611253,
        "upper": 0.58115220388747,
        "point": 0.5
      }
    },
    {
      "name": "fair_coin_100_trials_99pct",
      "inputs": {
        "successes": 50,
        "trials": 100,
        "confidence": 0.99
      },
      "expected": {
        "lower": 0.37527962504484,
        "upper": 0.62472037495516,
        "point": 0.5
      }
    },
    {
      "name": "low_rate_2_of_100_95pct",
      "inputs": {
        "successes": 2,
        "trials": 100,
        "confidence": 0.95
      },
      "expected": {
        "lower": 0.00550196755016235,
        "upper": 0.0700117907285439,
        "point": 0.02
      }
    },
    {
      "name": "single_trial_success_95pct",
      "inputs": {
        "successes": 1,
        "trials": 1,
        "confidence": 0.95
      },
      "expected": {
        "lower": 0.206549314377238,
        "upper": 1,
        "point": 1
      }
    }
  ]
}
